{
  "rpc": "https://sepolia.example-rpc.invalid",
  "chainId": 11155111,
  "deployerPrivateKeyEnv": "DEPLOYER_PRIVATE_KEY",
  "tokenName": "Example Test Token",
  "symbol": "ETT",
  "decimals": 18,
  "initialSupply": "1000000",
  "isTest": true,
  "isUpgradeable": false,
  "confirmations": 2,
  "verify": {
    "enabled": false
  },
  "metadata": {
    "project": "erc20-deploy",
    "notes": "Example only. Do not deploy this config without replacing addresses and RPC."
  }
}
